{
  "schema": "aion.agent-definition/1",
  "agent_id": "aion-reviewer",
  "version": "0.1.0",
  "role_refs": [
    "aion.role.06"
  ],
  "description": "Read-only review of scoped code changes, giving line-cited severity-ranked findings",
  "mode": "subagent",
  "instruction": {
    "repo": "owenservera/zcode-setup",
    "path": "playbook/agents/aion-reviewer.md",
    "sha256": "aaaaaaaaaaaaaaaaaaaaaaaaaaaaaaaaaaaaaaaaaaaaaaaaaaaaaaaaaaaaaaaa"
  },
  "capabilities": {
    "allow": [
      "read",
      "glob",
      "grep"
    ],
    "deny": [
      "edit",
      "shell",
      "subagent",
      "external_directory",
      "webfetch",
      "websearch",
      "execute"
    ]
  },
  "skills": [],
  "model_policy": {
    "preference": null,
    "fallback": "deny"
  },
  "limits": {
    "max_steps": 12,
    "max_child_depth": 0,
    "max_fanout": 0
  },
  "provenance": {
    "source_repo": "owenservera/zcode-setup",
    "source_commit": "1111111111111111111111111111111111111111",
    "declared_utc": "2026-10-20T00:00:00Z"
  }
}
